State Act Title,Implementing Jurisdictions,Implementation Level,Intervention Type,Affected Products,Affected Jurisdictions,Date Implemented,Is In Force,Year
"EU: New sanctions package includes extended export and import bans, an investment prohibition on Russian mining projects, and other economic sanctions","Austria, Belgium, Bulgaria, Croatia, Cyprus, Czechia, Denmark, Estonia, Finland, France, Germany, Greece, Hungary, Ireland, Italy, Latvia, Lithuania, Luxembourg, Malta, Netherlands, Poland, Portugal, Romania, Slovakia, Slovenia, Spain, Sweden",Supranational,Export ban,"240412, 240492, 261210, 261220, 262099, 270710, 270720, 270730, 270740, 270750, 270799, 271012, 271019, 271020, 271111, 271112, 271113, 271114, 271119, 271129, 271220, 271290, 280410, 280429, 280440, 280450, 280512, 280519, 280800, 281000, 281111, 281112, 281129, 281211, 281212, 281213, 281214, 281215, 281216, 281217, 281219, 281290, 281390, 281820, 281990, 282110, 282510, 282560, 282590, 282619, 282690, 282739, 282749, 282759, 282760, 282890, 282990, 283010, 283090, 283220, 283329, 283330, 283340, 283410, 283429, 283510, 283529, 283539, 283699, 283711, 283719, 283990, 284020, 284030, 284190, 284290, 284410, 284420, 284430, 284441, 284442, 284443, 284444, 284450, 284510, 284520, 284530, 284540, 284590, 284920, 284990, 285000, 285310, 285390, 290343, 290344, 290345, 290346, 290347, 290348, 290349, 290351, 290359, 290376, 290383, 290389, 290399, 290491, 290519, 290559, 290930, 290941, 290943, 290944, 291419, 291817, 291819, 292011, 292019, 292021, 292022, 292023, 292024, 292029, 292030, 292090, 292111, 292112, 292113, 292114, 292119, 292144, 292215, 292217, 292218, 292219, 292529, 292800, 292990, 293010, 293060, 293070, 293090, 293110, 293120, 293141, 293142, 293143, 293144, 293145, 293146, 293147, 293148, 293149, 293151, 293152, 293153, 293154, 293159, 293190, 293219, 293299, 293333, 293334, 293335, 293336, 293337, 293339, 293392, 293399, 293492, 293499, 293980, 300249, 300251, 300259, 310230, 310240, 320620, 320649, 321410, 340399, 340420, 340490, 360100, 360200, 360310, 360320, 360330, 360340, 360350, 360360, 370400, 370500, 370710, 380110, 380190, 381511, 381512, 381519, 381590, 381800, 381900, 382484, 382485, 382486, 382487, 382488, 382489, 382491, 382492, 382499, 382569, 382600, 390290, 390330, 390461, 390469, 390490, 390591, 390599, 390690, 390721, 390729, 390791, 390950, 391000, 391110, 391120, 391190, 391220, 391400, 391690, 391721, 391722, 391729, 391733, 391740, 392094, 392099, 392190, 392390, 392620, 392690, 400219, 400220, 400241, 400249, 400251, 400259, 400291, 400299, 400921, 400922, 400941, 400942, 401519, 401590, 401610, 401693, 401699, 401700, 420310, 490110, 490199, 490600, 491199, 540211, 540219, 540220, 540310, 540710, 550311, 550319, 550320, 550390, 550610, 550640, 550690, 550911, 550912, 560490, 560750, 590210, 590220, 590290, 590390, 620130, 620140, 620190, 620230, 620240, 620290, 621010, 621020, 621030, 621040, 621050, 621133, 621143, 621600, 630790, 640192, 680610, 681299, 681511, 681512, 681513, 681519, 681599, 690310, 690320, 690390, 690911, 690912, 690919, 690990, 691410, 691490, 700220, 701090, 701400, 701911, 701912, 701913, 701914, 701915, 701961, 701962, 701963, 701964, 701965, 701966, 701969, 701971, 701972, 701973, 701980, 701990, 702000, 710421, 710429, 710692, 710813, 711019, 711029, 711039, 711049, 711510, 711590, 720280, 720291, 720299, 721810, 721891, 721899, 721911, 721912, 721913, 721914, 721921, 721922, 721923, 721924, 721931, 721932, 721933, 721934, 721935, 721990, 722011, 722012, 722020, 722090, 722211, 722219, 722220, 722230, 722240, 722490, 722511, 722519, 722530, 722540, 722550, 722591, 722592, 722599, 722611, 722619, 722620, 722691, 722692, 722699, 722810, 722830, 722840, 722850, 722860, 722880, 730441, 730449, 730451, 730459, 730490, 730630, 730640, 730650, 730661, 730669, 730690, 730830, 730890, 730900, 731010, 731021, 731029, 732510, 732599, 732619, 732620, 732690, 741021, 741920, 741980, 750220, 750300, 750400, 750512, 750522, 750620, 750711, 750712, 750720, 750890, 760120, 760200, 760310, 760320, 760429, 760529, 760692, 760820, 760900, 761100, 761210, 761290, 761699, 780600, 790700, 800300, 800700, 810110, 810194, 810196, 810197, 810199, 810210, 810299, 810399, 810411, 810419, 810420, 810430, 810490, 810590, 810610, 810690, 810820, 810890, 810921, 810929, 810931, 810991, 810999, 811090, 811100, 811212, 811213, 811219, 811221, 811229, 811231, 811239, 811241, 811249, 811259, 811269, 811292, 811299, 811300, 820730, 840110, 840120, 840130, 840140, 840710, 840810, 840910, 841111, 841112, 841121, 841122, 841181, 841182, 841191, 841199, 841210, 841221, 841229, 841231, 841239, 841280, 841290, 841350, 841360, 841370, 841381, 841382, 841391, 841410, 841430, 841440, 841459, 841460, 841470, 841480, 841490, 841710, 841780, 841861, 841869, 841899, 841920, 841933, 841939, 841940, 841950, 841960, 841989, 841990, 842119, 842121, 842122, 842129, 842139, 842199, 842230, 842420, 842430, 842449, 842482, 842489, 842490, 842611, 842619, 842699, 842839, 842870, 842890, 844331, 844332, 844399, 844400, 844520, 844590, 844610, 844621, 844629, 844630, 844711, 844712, 844720, 844790, 844820, 844839, 844842, 844849, 844859, 845420, 845430, 845490, 845611, 845630, 845650, 845690, 845710, 845720, 845730, 845811, 845891, 845910, 845921, 845929, 845931, 845939, 845941, 845949, 845951, 845961, 846012, 846022, 846023, 846024, 846040, 846120, 846140, 846190, 846290, 846390, 846420, 846490, 846520, 846591, 846592, 846593, 846596, 846599, 846610, 846620, 846630, 846691, 846692, 846693, 846694, 846880, 846890, 847130, 847141, 847149, 847150, 847160, 847170, 847180, 847190, 847330, 847420, 847521, 847590, 847780, 847950, 847981, 847982, 847983, 847989, 847990, 848041, 848049, 848110, 848120, 848130, 848140, 848180, 848190, 848210, 848230, 848250, 848280, 848291, 848299, 848310, 848330, 848340, 848420, 848490, 848510, 848610, 848620, 848630, 848640, 848690, 848710, 848790, 850131, 850132, 850133, 850134, 850171, 850172, 850239, 850300, 850410, 850440, 850450, 850511, 850590, 850650, 850680, 850750, 850760, 850780, 850819, 850860, 851411, 851419, 851420, 851431, 851432, 851439, 851440, 851490, 851511, 851519, 851521, 851529, 851531, 851539, 851580, 851590, 851680, 851711, 851713, 851714, 851718, 851761, 851762, 851769, 851771, 851779, 851840, 851890, 851981, 851989, 852190, 852290, 852321, 852329, 852349, 852351, 852352, 852359, 852380, 852550, 852560, 852581, 852582, 852583, 852589, 852610, 852691, 852692, 852713, 852719, 852721, 852729, 852791, 852792, 852799, 852842, 852849, 852852, 852859, 852862, 852910, 852990, 853180, 853190, 853225, 853229, 853321, 853400, 853510, 853521, 853529, 853530, 853540, 853590, 853610, 853620, 853630, 853641, 853649, 853650, 853661, 853669, 853670, 853690, 853710, 853720, 853890, 854020, 854079, 854089, 854091, 854099, 854110, 854121, 854129, 854130, 854141, 854142, 854143, 854149, 854151, 854159, 854160, 854190, 854231, 854232, 854233, 854239, 854310, 854320, 854330, 854370, 854390, 854411, 854419, 854420, 854442, 854449, 854460, 854470, 854519, 854590, 854800, 860400, 860900, 870422, 870423, 870432, 870442, 870443, 870452, 870590, 880100, 880211, 880212, 880220, 880230, 880240, 880260, 880610, 880621, 880622, 880623, 880624, 880629, 880691, 880692, 880693, 880694, 880699, 880710, 880720, 880730, 880790, 890590, 890690, 900110, 900190, 900220, 900290, 900580, 900630, 900640, 900653, 900659, 900691, 900699, 900710, 900791, 901320, 901380, 901390, 901410, 901420, 901480, 901490, 901580, 901590, 901720, 901850, 901890, 902000, 902212, 902219, 902229, 902230, 902290, 902300, 902410, 902480, 902490, 902519, 902620, 902690, 902710, 902720, 902730, 902750, 902781, 902789, 902790, 902920, 903010, 903020, 903033, 903040, 903082, 903089, 903090, 903110, 903120, 903141, 903149, 903180, 903190, 930110, 930190, 930390, 930400, 930599, 930690, 940320, 940360, 940370, 940389, 940549, 962000","Afghanistan, Albania, Algeria, Andorra, Angola, Azerbaijan, Argentina, Australia, Bahamas, Bahrain, Bangladesh, Armenia, Barbados, Bermuda, Bhutan, Bolivia, Bosnia & Herzegovina, Botswana, Brazil, Belize, Brunei Darussalam, Myanmar, Belarus, Cambodia, Cameroon, Canada, Cape Verde, Central African Republic, Sri Lanka, Chad, Chile, China, Colombia, Congo, DR Congo, Cook Islands, Costa Rica, Cuba, Benin, Dominican Republic, Ecuador, El Salvador, Equatorial Guinea, Ethiopia, Eritrea, Fiji, French Polynesia, Djibouti, Gabon, Georgia, Gambia, Ghana, Grenada, Guam, Guatemala, Guinea, Guyana, Haiti, Honduras, Hong Kong, Iceland, Indonesia, Iran, Iraq, Israel, Ivory Coast, Jamaica, Japan, Kazakhstan, Jordan, Kenya, Republic of Korea, Kuwait, Kyrgyzstan, Lao, Lebanon, Liberia, Libya, Macao, Madagascar, Malawi, Malaysia, Maldives, Mali, Mauritania, Mauritius, Mexico, Mongolia, Republic of Moldova, Montenegro, Morocco, Mozambique, Oman, Namibia, Nepal, Aruba, New Caledonia, New Zealand, Nicaragua, Niger, Nigeria, Palau, Pakistan, Panama, Papua New Guinea, Paraguay, Peru, Philippines, Guinea-Bissau, Qatar, Russia, Rwanda, Saint Helena, Saint Kitts & Nevis, Saint Vincent & the Grenadines, Sao Tome & Principe, Saudi Arabia, Senegal, Serbia, Seychelles, Sierra Leone, India, Singapore, Vietnam, Somalia, South Africa, Zimbabwe, South Sudan, Republic of the Sudan, Suriname, Switzerland, Syria, Tajikistan, Thailand, Togo, Tokelau, Trinidad & Tobago, United Arab Emirates, Tunisia, Turkiye, Turkmenistan, Uganda, Ukraine, Macedonia, Egypt, United Kingdom, Tanzania, United States of America, Burkina Faso, Uruguay, Uzbekistan, Venezuela, Yemen, Zambia",2022-12-17,1,2022
United States of America: Thirty-six companies added to the Commerce Department’s Entity List,United States of America,National,Export licensing requirement,"261210, 261220, 262099, 270710, 270720, 270730, 270740, 270750, 270799, 271012, 271019, 271020, 271112, 271113, 271114, 271119, 271129, 271220, 271290, 280429, 280450, 280512, 280519, 281000, 281111, 281112, 281129, 281211, 281290, 281390, 281990, 282110, 282510, 282560, 282590, 282619, 282690, 282739, 282749, 282759, 282890, 282990, 283010, 283090, 283220, 283329, 283330, 283340, 283410, 283429, 283510, 283529, 283539, 283699, 283711, 283719, 283990, 284020, 284030, 284190, 284290, 284410, 284420, 284430, 284441, 284442, 284443, 284444, 284450, 284510, 284520, 284530, 284540, 284590, 284920, 284990, 285000, 290343, 290344, 290345, 290346, 290347, 290348, 290349, 290351, 290359, 290376, 290383, 290389, 290399, 290491, 290519, 290559, 290930, 290941, 290943, 290944, 291419, 291817, 291819, 292011, 292019, 292021, 292022, 292023, 292024, 292029, 292030, 292090, 292111, 292112, 292113, 292114, 292119, 292144, 292217, 292218, 292219, 292529, 292800, 292990, 293010, 293060, 293070, 293090, 293110, 293120, 293141, 293142, 293143, 293144, 293145, 293146, 293147, 293148, 293149, 293151, 293152, 293153, 293154, 293159, 293190, 293334, 293335, 293336, 293337, 293339, 293392, 293399, 300249, 300251, 300259, 320620, 320649, 321410, 340399, 340420, 340490, 360200, 360310, 360320, 360330, 360340, 360350, 360360, 370400, 370710, 380110, 380190, 381511, 381512, 381519, 381590, 381800, 381900, 382219, 382290, 382484, 382485, 382486, 382487, 382488, 382489, 382491, 382492, 382499, 382569, 382600, 390290, 390330, 390469, 390490, 390591, 390599, 390690, 390721, 390791, 391000, 391110, 391120, 391190, 391400, 391690, 391721, 391722, 391729, 391733, 391740, 391990, 392094, 392099, 392119, 392190, 392390, 392620, 392690, 400219, 400220, 400241, 400249, 400251, 400259, 400291, 400299, 400921, 400922, 400941, 400942, 401519, 401590, 401610, 401693, 401699, 401700, 490110, 490199, 490600, 491199, 540211, 540219, 540220, 540310, 540710, 550311, 550319, 550320, 550390, 550610, 550640, 550690, 550911, 550912, 560490, 560750, 590210, 590220, 590290, 590390, 621010, 621040, 621050, 621133, 621143, 621600, 630790, 640192, 680610, 681299, 681511, 681512, 681513, 681599, 690310, 690320, 690390, 690911, 690912, 690919, 690990, 691410, 691490, 700220, 701090, 701400, 701911, 701912, 701913, 701914, 701915, 701961, 701962, 701963, 701964, 701965, 701966, 701969, 701972, 701973, 701980, 701990, 702000, 710421, 710429, 710499, 710692, 710813, 711019, 711029, 711039, 711049, 711510, 711590, 720280, 720291, 720299, 721891, 721899, 721911, 721912, 721913, 721914, 721921, 721922, 721923, 721924, 721931, 721932, 721933, 721934, 721935, 721990, 722011, 722012, 722020, 722090, 722211, 722219, 722220, 722230, 722240, 722490, 722511, 722519, 722530, 722540, 722550, 722591, 722592, 722599, 722611, 722620, 722691, 722692, 722699, 722810, 722830, 722840, 722850, 722860, 722880, 730441, 730449, 730451, 730459, 730490, 730630, 730640, 730650, 730661, 730669, 730690, 730900, 731010, 731021, 731029, 732619, 732620, 732690, 741021, 750220, 750300, 750400, 750512, 750522, 750620, 750711, 750712, 750720, 750890, 760120, 760200, 760310, 760320, 760429, 760529, 760692, 760820, 760900, 761210, 761290, 761699, 780600, 790700, 800300, 800700, 810110, 810194, 810196, 810197, 810199, 810210, 810296, 810299, 810399, 810411, 810419, 810430, 810490, 810590, 810610, 810820, 810890, 811090, 811100, 811212, 811213, 811219, 811221, 811231, 811239, 811241, 811249, 811259, 811292, 811299, 811300, 820730, 840110, 840120, 840130, 840140, 840710, 840810, 840910, 841111, 841112, 841121, 841122, 841181, 841182, 841191, 841199, 841210, 841221, 841229, 841231, 841239, 841280, 841290, 841350, 841360, 841370, 841381, 841382, 841391, 841410, 841430, 841440, 841459, 841460, 841470, 841480, 841490, 841780, 841861, 841869, 841899, 841933, 841939, 841940, 841950, 841989, 841990, 842119, 842121, 842122, 842129, 842139, 842199, 842230, 842420, 842430, 842449, 842482, 842489, 842611, 842619, 842699, 842839, 842870, 842890, 843149, 844331, 844332, 844399, 844400, 844610, 844621, 844629, 844630, 844711, 844712, 844720, 844790, 844820, 844839, 844842, 844849, 844859, 845420, 845430, 845490, 845611, 845620, 845630, 845650, 845690, 845710, 845720, 845730, 845811, 845891, 845910, 845921, 845931, 845941, 845949, 845951, 845961, 846022, 846023, 846024, 846040, 846120, 846140, 846190, 846290, 846390, 846420, 846490, 846520, 846592, 846593, 846599, 846610, 846620, 846630, 846691, 846692, 846693, 846694, 846880, 846890, 847130, 847141, 847149, 847150, 847160, 847170, 847180, 847190, 847330, 847420, 847521, 847590, 847780, 847950, 847982, 847983, 847989, 847990, 848041, 848049, 848110, 848120, 848130, 848140, 848180, 848190, 848210, 848230, 848250, 848280, 848291, 848299, 848310, 848330, 848340, 848420, 848490, 848510, 848610, 848620, 848630, 848640, 848690, 848710, 848790, 850132, 850133, 850134, 850171, 850172, 850300, 850410, 850440, 850450, 850511, 850590, 850650, 850680, 850750, 850760, 850780, 850819, 850860, 850870, 851411, 851419, 851420, 851431, 851432, 851439, 851440, 851490, 851511, 851519, 851521, 851529, 851531, 851539, 851580, 851590, 851680, 851711, 851713, 851714, 851718, 851761, 851762, 851769, 851771, 851779, 851840, 851890, 851981, 851989, 852110, 852190, 852290, 852329, 852349, 852351, 852352, 852359, 852380, 852550, 852560, 852581, 852582, 852583, 852589, 852610, 852691, 852692, 852713, 852719, 852721, 852729, 852791, 852792, 852799, 852842, 852849, 852852, 852859, 852910, 852990, 853180, 853190, 853225, 853229, 853321, 853510, 853521, 853529, 853530, 853540, 853590, 853610, 853620, 853630, 853641, 853649, 853650, 853661, 853669, 853670, 853690, 853710, 853720, 853890, 854020, 854079, 854089, 854091, 854099, 854110, 854121, 854129, 854130, 854141, 854142, 854143, 854149, 854151, 854159, 854160, 854190, 854231, 854232, 854233, 854239, 854310, 854320, 854330, 854370, 854390, 854411, 854419, 854420, 854442, 854449, 854470, 854511, 854519, 854590, 860400, 860900, 870422, 870423, 870432, 870442, 870443, 870590, 880100, 880211, 880212, 880220, 880230, 880240, 880260, 880521, 880529, 880610, 880621, 880622, 880623, 880624, 880629, 880691, 880692, 880693, 880694, 880699, 890110, 890120, 890130, 890190, 890200, 890590, 890690, 900110, 900190, 900290, 900510, 900580, 900630, 900640, 900653, 900659, 900691, 900699, 900710, 900791, 901310, 901320, 901380, 901390, 901410, 901420, 901480, 901490, 901580, 901590, 901720, 901850, 901890, 902000, 902212, 902219, 902229, 902230, 902290, 902300, 902410, 902480, 902490, 902519, 902610, 902620, 902680, 902690, 902710, 902720, 902730, 902750, 902781, 902789, 902790, 902920, 903010, 903020, 903033, 903040, 903082, 903089, 903090, 903110, 903120, 903141, 903149, 903180, 903190, 903300, 930390, 930400, 930591, 930599, 930690, 940549, 962000","China, Japan",2022-12-16,1,2022
"EU: New sanctions package includes extended export and import bans, an investment prohibition on Russian mining projects, and other economic sanctions","Austria, Belgium, Bulgaria, Croatia, Cyprus, Czechia, Denmark, Estonia, Finland, France, Germany, Greece, Hungary, Ireland, Italy, Latvia, Lithuania, Luxembourg, Malta, Netherlands, Poland, Portugal, Romania, Slovakia, Slovenia, Spain, Sweden",Supranational,Export ban,"271019, 840710, 840910, 847130, 847141, 847149, 847150, 847160, 847170, 847180, 847190, 847330, 850220, 851511, 851519, 851761, 852351, 852691, 852692, 853400, 900211, 900219, 900710, 901310, 950300",Russia,2022-12-17,1,2022
United States of America: U.S. Administration stops issuing licenses for exports to Huawei,United States of America,National,Export ban,"392310, 701710, 702000, 848071, 848620, 848640, 848690, 850490, 851711, 851713, 851714, 851718, 851761, 851762, 851769, 851771, 851779, 851981, 852351, 852411, 852412, 852419, 852491, 852492, 852499, 854149, 854151, 854159, 854190, 903082, 903090, 903141","Algeria, Angola, Azerbaijan, Argentina, Australia, Austria, Bahamas, Bahrain, Bangladesh, Barbados, Belgium, Bermuda, Bolivia, Bosnia & Herzegovina, Brazil, Belize, Brunei Darussalam, Bulgaria, Cameroon, Canada, Sri Lanka, Chile, China, Colombia, DR Congo, Costa Rica, Croatia, Cyprus, Czechia, Denmark, Dominican Republic, Ecuador, El Salvador, Ethiopia, Estonia, Finland, France, Djibouti, Gambia, Germany, Ghana, Greece, Grenada, Guatemala, Guyana, Haiti, Honduras, Hong Kong, Hungary, Iceland, Indonesia, Iraq, Ireland, Israel, Italy, Ivory Coast, Jamaica, Japan, Jordan, Kenya, Republic of Korea, Kuwait, Latvia, Libya, Lithuania, Luxembourg, Macao, Malaysia, Maldives, Mali, Malta, Mexico, Mongolia, Republic of Moldova, Morocco, Oman, Nepal, Netherlands, Aruba, New Zealand, Nicaragua, Nigeria, Pakistan, Panama, Papua New Guinea, Paraguay, Peru, Philippines, Poland, Portugal, Qatar, Romania, Russia, Rwanda, Saint Kitts & Nevis, Saint Lucia, Saint Vincent & the Grenadines, Saudi Arabia, Serbia, India, Singapore, Slovakia, Vietnam, Slovenia, Somalia, South Africa, Spain, Sweden, Switzerland, Thailand, Trinidad & Tobago, United Arab Emirates, Tunisia, Turkiye, Uganda, Ukraine, Egypt, United Kingdom, Tanzania, Burkina Faso, Uruguay, Venezuela",2023-01-30,1,2023
"Switzerland: Adoption of further economic sanctions against Russia, including extended export bans and an investment prohibition on Russian mining projects",Switzerland,National,Export ban,"261210, 261220, 262099, 270710, 270720, 270730, 270740, 270750, 270799, 271012, 271019, 271020, 271112, 271113, 271114, 271119, 271129, 271220, 271290, 280429, 280450, 280512, 280519, 281000, 281111, 281112, 281129, 281211, 281290, 281390, 281990, 282110, 282510, 282560, 282590, 282619, 282690, 282739, 282749, 282759, 282890, 282990, 283010, 283090, 283220, 283329, 283330, 283340, 283410, 283429, 283510, 283529, 283539, 283699, 283711, 283719, 283990, 284020, 284030, 284190, 284290, 284410, 284420, 284430, 284441, 284442, 284443, 284444, 284450, 284510, 284520, 284530, 284540, 284590, 284920, 284990, 285000, 290343, 290344, 290345, 290346, 290347, 290348, 290349, 290351, 290359, 290376, 290383, 290389, 290399, 290491, 290519, 290559, 290930, 290941, 290943, 290944, 291419, 291817, 291819, 292011, 292019, 292021, 292022, 292023, 292024, 292029, 292030, 292090, 292111, 292112, 292113, 292114, 292119, 292144, 292217, 292218, 292219, 292529, 292800, 292990, 293010, 293060, 293070, 293090, 293110, 293120, 293141, 293142, 293143, 293144, 293145, 293146, 293147, 293148, 293149, 293151, 293152, 293153, 293154, 293159, 293190, 293334, 293335, 293336, 293337, 293339, 293392, 293399, 300249, 300251, 300259, 320620, 320649, 321410, 340399, 340420, 340490, 360200, 360310, 360320, 360330, 360340, 360350, 360360, 370400, 370710, 380110, 380190, 381511, 381512, 381519, 381590, 381800, 381900, 382219, 382290, 382484, 382485, 382486, 382487, 382488, 382489, 382491, 382492, 382499, 382569, 382600, 390290, 390330, 390469, 390490, 390591, 390599, 390690, 390721, 390791, 391000, 391110, 391120, 391190, 391400, 391690, 391721, 391722, 391729, 391733, 391740, 391990, 392094, 392099, 392119, 392190, 392390, 392620, 392690, 400219, 400220, 400241, 400249, 400251, 400259, 400291, 400299, 400921, 400922, 400941, 400942, 401519, 401590, 401610, 401693, 401699, 401700, 490110, 490199, 490600, 491199, 540211, 540219, 540220, 540310, 540710, 550311, 550319, 550320, 550390, 550610, 550640, 550690, 550911, 550912, 560490, 560750, 590210, 590220, 590290, 590390, 621010, 621040, 621050, 621133, 621143, 621600, 630790, 640192, 680610, 681299, 681511, 681512, 681513, 681599, 690310, 690320, 690390, 690911, 690912, 690919, 690990, 691410, 691490, 700220, 701090, 701400, 701911, 701912, 701913, 701914, 701915, 701961, 701962, 701963, 701964, 701965, 701966, 701969, 701972, 701973, 701980, 701990, 702000, 710421, 710429, 710499, 710692, 710813, 711019, 711029, 711039, 711049, 711510, 711590, 720280, 720291, 720299, 721891, 721899, 721911, 721912, 721913, 721914, 721921, 721922, 721923, 721924, 721931, 721932, 721933, 721934, 721935, 721990, 722011, 722012, 722020, 722090, 722211, 722219, 722220, 722230, 722240, 722490, 722511, 722519, 722530, 722540, 722550, 722591, 722592, 722599, 722611, 722620, 722691, 722692, 722699, 722810, 722830, 722840, 722850, 722860, 722880, 730441, 730449, 730451, 730459, 730490, 730630, 730640, 730650, 730661, 730669, 730690, 730900, 731010, 731021, 731029, 732619, 732620, 732690, 741021, 750220, 750300, 750400, 750512, 750522, 750620, 750711, 750712, 750720, 750890, 760120, 760200, 760310, 760320, 760429, 760529, 760692, 760820, 760900, 761210, 761290, 761699, 780600, 790700, 800300, 800700, 810110, 810194, 810196, 810197, 810199, 810210, 810296, 810299, 810399, 810411, 810419, 810430, 810490, 810590, 810610, 810820, 810890, 811090, 811100, 811212, 811213, 811219, 811221, 811231, 811239, 811241, 811249, 811259, 811292, 811299, 811300, 820730, 840110, 840120, 840130, 840140, 840710, 840810, 840910, 841111, 841112, 841121, 841122, 841181, 841182, 841191, 841199, 841210, 841221, 841229, 841231, 841239, 841280, 841290, 841350, 841360, 841370, 841381, 841382, 841391, 841410, 841430, 841440, 841459, 841460, 841470, 841480, 841490, 841780, 841861, 841869, 841899, 841933, 841939, 841940, 841950, 841989, 841990, 842119, 842121, 842122, 842129, 842139, 842199, 842230, 842420, 842430, 842449, 842482, 842489, 842611, 842619, 842699, 842839, 842870, 842890, 843149, 844331, 844332, 844399, 844400, 844610, 844621, 844629, 844630, 844711, 844712, 844720, 844790, 844820, 844839, 844842, 844849, 844859, 845420, 845430, 845490, 845611, 845620, 845630, 845650, 845690, 845710, 845720, 845730, 845811, 845891, 845910, 845921, 845931, 845941, 845949, 845951, 845961, 846022, 846023, 846024, 846040, 846120, 846140, 846190, 846290, 846390, 846420, 846490, 846520, 846592, 846593, 846599, 846610, 846620, 846630, 846691, 846692, 846693, 846694, 846880, 846890, 847130, 847141, 847149, 847150, 847160, 847170, 847180, 847190, 847330, 847420, 847521, 847590, 847780, 847950, 847982, 847983, 847989, 847990, 848041, 848049, 848110, 848120, 848130, 848140, 848180, 848190, 848210, 848230, 848250, 848280, 848291, 848299, 848310, 848330, 848340, 848420, 848490, 848510, 848610, 848620, 848630, 848640, 848690, 848710, 848790, 850132, 850133, 850134, 850171, 850172, 850300, 850410, 850440, 850450, 850511, 850590, 850650, 850680, 850750, 850760, 850780, 850819, 850860, 850870, 851411, 851419, 851420, 851431, 851432, 851439, 851440, 851490, 851511, 851519, 851521, 851529, 851531, 851539, 851580, 851590, 851680, 851711, 851713, 851714, 851718, 851761, 851762, 851769, 851771, 851779, 851840, 851890, 851981, 851989, 852110, 852190, 852290, 852329, 852349, 852351, 852352, 852359, 852380, 852550, 852560, 852581, 852582, 852583, 852589, 852610, 852691, 852692, 852713, 852719, 852721, 852729, 852791, 852792, 852799, 852842, 852849, 852852, 852859, 852910, 852990, 853180, 853190, 853225, 853229, 853321, 853510, 853521, 853529, 853530, 853540, 853590, 853610, 853620, 853630, 853641, 853649, 853650, 853661, 853669, 853670, 853690, 853710, 853720, 853890, 854020, 854079, 854089, 854091, 854099, 854110, 854121, 854129, 854130, 854141, 854142, 854143, 854149, 854151, 854159, 854160, 854190, 854231, 854232, 854233, 854239, 854310, 854320, 854330, 854370, 854390, 854411, 854419, 854420, 854442, 854449, 854470, 854511, 854519, 854590, 860400, 860900, 870422, 870423, 870432, 870442, 870443, 870590, 880100, 880211, 880212, 880220, 880230, 880240, 880260, 880521, 880529, 880610, 880621, 880622, 880623, 880624, 880629, 880691, 880692, 880693, 880694, 880699, 890110, 890120, 890130, 890190, 890200, 890590, 890690, 900110, 900190, 900290, 900510, 900580, 900630, 900640, 900653, 900659, 900691, 900699, 900710, 900791, 901310, 901320, 901380, 901390, 901410, 901420, 901480, 901490, 901580, 901590, 901720, 901850, 901890, 902000, 902212, 902219, 902229, 902230, 902290, 902300, 902410, 902480, 902490, 902519, 902610, 902620, 902680, 902690, 902710, 902720, 902730, 902750, 902781, 902789, 902790, 902920, 903010, 903020, 903033, 903040, 903082, 903089, 903090, 903110, 903120, 903141, 903149, 903180, 903190, 903300, 930390, 930400, 930591, 930599, 930690, 940549, 962000",Russia,2023-01-25,1,2023
